{
  "schemaVersion": 1,
  "id": "street-night-1",
  "kit": "street",
  "palette": "night",
  "description": "A city street at night: moon, stars, streetlamps, closed shop. Standing.",
  "tags": ["night", "late", "going out", "party", "walking home", "city", "nightlife", "taxi", "weekend"],
  "groundY": 1480,
  "figureHeightPx": 720,
  "layers": [
    { "part": "sky", "variant": "night" },
    { "part": "buildings" },
    { "part": "sidewalk" },
    { "part": "shopfront", "x": 0.52 },
    { "part": "lamp", "x": 0.07 },
    { "part": "lamp", "x": 0.93, "flip": true }
  ],
  "marks": { "left": 0.27, "center": 0.5, "right": 0.73 }
}
