{
  "schemaVersion": 1,
  "id": "wide-living",
  "aspect": "16:9",
  "kit": "interior",
  "palette": "lilac",
  "description": "A wide living room: window at the left edge, pictures and a plant at the right. Standing. The 16:9 exchange default.",
  "tags": ["widescreen", "home", "family", "roommates", "couple", "weekend"],
  "groundY": 900,
  "figureHeightPx": 620,
  "layers": [
    { "part": "wall", "pattern": "halftone" },
    { "part": "floor" },
    { "part": "window", "x": 0.1, "y": 0.12 },
    { "part": "frame", "x": 0.72, "y": 0.16 },
    { "part": "frame", "x": 0.86, "y": 0.2, "size": 0.7, "seed": 4 },
    { "part": "shelf", "x": 0.78, "y": 0.34 },
    { "part": "plant", "x": 0.94 }
  ],
  "foreground": [],
  "marks": { "left": 0.28, "center": 0.5, "right": 0.72 }
}
